{
  "protocol_version": "0.5",
  "project_status": "active",
  "phase": "execution",
  "adoption": {
    "mode": "greenfield",
    "adopted_at": null,
    "baseline_commit": null
  },
  "product_definition": {
    "status": "accepted",
    "accepted_at": "2026-08-30T14:58:55Z"
  },
  "verification": {
    "status": "passed",
    "level": "quick",
    "command": "python3 scripts/roach_check.py && npm run check && python3 -m pytest tools/map_compiler/tests",
    "notes": "PR #11 final production-only head passed the declared T010 task check, full map-compiler tests, web runtime, project health, lint/types/schemas, Ubuntu Roach coordination, and Windows Roach coordination; temporary Chromium artifact 9779977412 also passed real-browser Roadbed/reset smoke verification. Merged as 534ed6e1.",
    "verified_at": "2026-08-31T23:45:59Z",
    "commit": "534ed6e15f320e24d9b8d9d0456c2131d978c44c"
  },
  "blocked": null,
  "updated_at": "2026-08-31T23:45:59Z"
}
